{
  "name": "Lead",
  "tuning": [0, 0, 0, 0, 0, 0],
  "capo": 0,
  "notes": [
    {"t": 0.0, "s": 0, "f": 0, "sus": 0.25},
    {"t": 0.5, "s": 1, "f": 2, "sus": 0.5, "bn": 1.0, "bt": 4,
     "bnv": [{"t": 0, "v": 0}, {"t": 0.25, "v": 1.0}, {"t": 0.5, "v": 0}]},
    {"t": 1.0, "s": 2, "f": 2, "sus": 0.25}
  ],
  "chords": [
    {"t": 2.0, "id": 0, "notes": [
      {"s": 1, "f": 2},
      {"s": 2, "f": 2},
      {"s": 3, "f": 0}
    ]}
  ],
  "anchors": [
    {"time": 0.0, "fret": 1, "width": 4}
  ],
  "handshapes": [
    {"chord_id": 0, "start_time": 2.0, "end_time": 3.0, "arp": false}
  ],
  "templates": [
    {"name": "Em", "displayName": "Em", "arp": false,
     "fingers": [-1, 2, 1, -1, -1, -1], "frets": [0, 2, 2, 0, 0, 0]}
  ]
}
